id;type;seo_title;seo_description
126417;post;Fidéliser vos clients : 5 étapes indispensables;Apprenez à fidéliser vos clients en 5 étapes clés : comprendre leurs besoins, qualifier et segmenter pour optimiser l’expérience client.
124423;post;Pub Clio Get Up : 20 ans d'annonces iconiques Renault;Explorez 20 ans d'annonces marquantes pour la Renault Clio et découvrez l'évolution du slogan et l'esprit Get Up qui a transformé la pub automobile.
1287445455;post;Post-numérique : internet en mutation ? Analyse et enjeux;Plongez dans l’ère post-digitale et découvrez comment Internet se transforme. Analysez les enjeux d’un monde digital en mutation et réexaminez son avenir.
1287443133;post;Behind the scenes: l'histoire du parcours client dévoilée;Apprenez comment les témoignages clients révèlent les coulisses de leur parcours d'achat et dynamisent votre stratégie éditoriale.
1287443477;post;Taux de réactivité : boostez vos campagnes d’emailing;Mesurez le taux de réactivité et d’autres indicateurs essentiels pour optimiser vos campagnes d’emailing. Apprenez à améliorer vos résultats dès aujourd'hui.
34760;post;Logo stratégie : astuces et techniques gagnantes;Apprenez à concevoir un logo percutant avec des techniques éprouvées et des outils adaptés. Améliorez l'image de votre marque dès aujourd'hui !
1287500773;post;Format 4:5 sur Instagram : guide pour un post parfait;Apprenez à maîtriser le format 4:5 sur Instagram pour un affichage optimal. Suivez nos astuces pratiques et sublimez votre feed.
1287440861;post;InDesign : 7 astuces pour booster votre efficacité;Découvrez 7 astuces pratiques pour maîtriser InDesign et gagner du temps. Boostez votre créativité grâce à des conseils experts.
1287441631;post;Comment faire une fiche de poste : 5 conseils efficaces;Apprenez comment faire une fiche de poste cohérente et détaillée pour réussir vos recrutements. Lisez nos conseils pratiques pour attirer le bon profil.
128267;post;Snickers : un Mars et ça repart – retour de pub iconique;En 2012, après 10 ans d'absence, Snickers relance sa notoriété. Mars et ça repart : un slogan iconique redynamise sa pub. Lisez notre analyse.
124725;post;Signification des couleurs : boostez votre marketing;Apprenez comment la signification des couleurs oriente vos stratégies marketing et créations graphiques pour capter l’attention de vos clients.
4897;post;Slideshare pour les pros : boostez vos présentations | 1min30;Accédez à la ressource Slideshare pour les pros. Découvrez astuces et conseils pour optimiser vos présentations et inspirer votre audience dès aujourd’hui.
127961;post;Sophistication : 5 niveaux de maturité du marché;Apprenez à adapter votre message selon les 5 niveaux de sophistication du marché. 'Breakthrough Advertising' révèle comment capter l'attention. Consultez notre guide.
1287440467;post;Wireframe web : outils indispensables pour vos maquettes;Explorez les meilleurs outils pour concevoir vos wireframes : des maquettes claires et efficaces pour faciliter la communication entre client et graphiste.
1287440383;post;Comment utiliser l'intelligence artificielle : 6 clés;Découvrez 6 méthodes concrètes pour intégrer l'intelligence artificielle dans votre stratégie marketing et améliorer vos performances dès aujourd'hui.
1287440209;post;Exemple éditorial : 4 étapes pour maîtriser la rédaction;Boostez votre contenu éditorial avec 4 étapes essentielles alliant rédaction et publication pour une stratégie réussie.
7064;post;Forum social media : 5 atouts pour dynamiser votre site;Apprenez comment l'intégration d'un forum social media renforce la fidélité et stimule l'engagement. Lisez notre guide complet pour booster votre site !
128231;post;Good to great : comment transformer la performance en excellence;Apprenez comment 'Good to great' de Jim Collins expose 6 étapes scientifiques pour transformer la performance en excellence. Lisez notre analyse complète.
121799;post;Techniques de prospection commerciale pour booster vos ventes;Apprenez à maîtriser la prospection commerciale avec des stratégies éprouvées pour attirer de nouveaux clients et augmenter vos ventes.
120869;post;SSI LinkedIn : boostez votre score en 4 conseils;Améliorez votre SSI LinkedIn avec 4 conseils efficaces pour renforcer votre marque professionnelle et optimiser votre réseau.
127087;post;Order bump : boostez votre panier moyen efficacement;Apprenez comment l’order bump, astuce simple et efficace, augmente votre panier moyen client. Guide pratique et conseils d’experts.
126965;post;Contenu éditorial : SEO et engagement gagnants;Apprenez à optimiser votre SEO avec un contenu éditorial structuré et une mesure précise de l’engagement. Suivez nos astuces concrètes.
126783;post;Plan de recrutement : maîtrisez l'inbound recruiting;Apprenez à élaborer un plan de recrutement massif et efficace avec l'inbound recruiting. Stratégies pratiques et conseils pour attirer les meilleurs talents.
6702;post;Marketing BtoC : 3 différences clés avec le BtoB;Découvrez les 3 différences majeures entre le marketing BtoB et BtoC et apprenez à adapter vos stratégies d’achat pour chaque segment.
127169;post;Matériel graphiste : outils indispensables;Apprenez à choisir les outils essentiels pour graphistes et boostez votre créativité avec du matériel de qualité. Lisez notre guide complet dès maintenant !
126465;post;Off-boarding en entreprise : pourquoi le mettre en place ?;Apprenez comment une politique d'off-boarding efficace renforce votre marque employeur et optimise la gestion des départs. Lisez nos conseils pratiques.
7210;post;Avantage Snap: boostez votre marque sur Snapchat;Profitez de l’avantage Snap pour dynamiser votre présence. Apprenez à toucher une audience jeune et engagée sur Snapchat.
126255;post;Tunnels de vente : transformation ou illusion marketing ?;Explorez l'univers des tunnels de vente : analyse experte, chiffres clés et conseils pratiques pour booster vos conversions. Lisez notre guide complet !
1287500782;post;Smart marketing : objectifs SMART pour votre réussite;Apprenez ce que sont les objectifs SMART et explorez les 5 critères qui font leur efficacité. Lisez notre analyse pour booster votre stratégie.
78395;post;Whaoo : 9 solutions pour une image marquante;Obtenez 9 solutions éprouvées pour trouver l'image parfaite qui crée un effet WhaOO et capte l'attention de vos clients. Lisez notre guide complet pour booster votre impact visuel.
124723;post;Force de conviction : 5 conseils pour convaincre;Apprenez 5 astuces éprouvées pour développer votre force de conviction et inspirer vos clients. Lisez notre guide dès aujourd'hui !
1287500792;post;Segmentation marketing : 4 stratégies pour booster vos cibles;Explorez 4 méthodes éprouvées pour optimiser votre segmentation marketing et atteindre vos prospects avec précision. Lisez notre guide complet.
120831;post;Que veut dire vintage : 5 raisons d’y succomber;Apprenez pourquoi le vintage dépasse la mode : un style de vie mêlant nostalgie, authenticité et durabilité. Lisez notre guide complet pour tout savoir !
120759;post;Brand Persona : guide pratique pour incarner votre marque;Explorez l’univers du brand persona et apprenez à aligner vos messages sur les besoins de votre audience. Boostez votre stratégie dès aujourd'hui !
113487;post;Adobe XD : boostez votre webdesign | 1min30;Explorez Adobe XD, l'outil Experience Design CC qui révolutionne le webdesign. Apprenez à booster vos performances sur 1min30.
6247;post;Live tweet : guide rapide pour débutants pressés;Maîtrisez l'art du live tweet grâce à nos étapes clés pour dynamiser vos événements et engager votre audience. Lisez notre guide pour réussir !
5702;post;Pub Instagram : fonctionnement, création et coût expliqués;Apprenez comment fonctionnent les pubs Instagram avec des astuces sur la création, le coût et les stratégies pour booster votre visibilité en ligne.
119479;post;Comment faire un livre : guide pratique en 10 étapes;Découvrez comment faire un livre étape par étape et maîtrisez les secrets du support imprimé pour un résultat professionnel. Lisez nos conseils pratiques !
119207;post;Quelle police choisir ? Guide graphisme et webdesign;Maîtrisez l'utilisation des polices d'écriture pour renforcer votre identité de marque. Lisez notre guide illustré pour un choix éclairé.
120327;post;Marque ombrelle : donnez vie à votre capital de marque;Explorez comment le brand marketing transforme votre entreprise en investissant dans une marque ombrelle solide et pérenne. Lisez notre guide complet maintenant !
119139;post;Advocacy en entreprise : devenez ambassadeurs | 1min30;Boostez votre stratégie RH en transformant vos salariés en ambassadeurs. Apprenez à mettre en place l’employee advocacy dès aujourd’hui !
118939;post;Volpy : comment une start-up corse rachète votre smartphone;Explorez l'histoire inspirante de Volpy, la start-up corse qui rachète votre smartphone et révolutionne la revente d'appareils. Lisez notre analyse !
112734;post;Prézi : 10 bonnes raisons pour booster vos présentations;Explorez comment Prezi révolutionne vos présentations grâce à son approche zoom innovante et interactive pour captiver l'audience.
1287500793;post;Que veut dire hashtag ? Guide et astuces pour bien l'utiliser | 1min30;Comprenez la signification du hashtag et maîtrisez son usage stratégique pour booster votre communication numérique. Lisez notre guide complet !
115067;post;Motivations d'achat : créez le message qui vend;Analysez les comportements d'achat et identifiez freins et leviers pour élaborer un message impactant. Lisez notre guide pour booster votre stratégie digitale.
1287500780;post;Plateforme vidéo : choisissez la meilleure solution;Explorez chaque option pour héberger et diffuser vos vidéos. Comparez Youtube, Dailymotion, Vimeo et Facebook avec notre analyse commerciale approfondie.
113143;post;Messaging : 5 règles d'or pour des messages percutants;Découvrez comment le messaging révolutionne la communication des marques. Apprenez 5 astuces essentielles pour dynamiser votre stratégie.
113391;post;Early adopters : fidélisez vos premiers clients efficacement;Apprenez comment transformer vos early adopters en ambassadeurs grâce à des stratégies marketing éprouvées et fidéliser vos premiers clients. Suivez nos conseils !
6826;post;Format Instagram : créez le post parfait sans effort;Maîtrisez le format Instagram pour transformer vos posts en œuvres visuelles percutantes. Apprenez à optimiser vos images et captiver votre audience.
6816;post;Plateforme de vidéo : guide pour choisir la meilleure;Comparez Youtube, Dailymotion, Vimeo et Facebook pour vos vidéos. Apprenez à choisir la plateforme adaptée à vos besoins.
1287500779;post;Planning social : créez un calendrier social media efficace;Optimisez votre planning social et boostez votre stratégie digitale. Apprenez à planifier vos contenus et à dynamiser votre présence en ligne.
111207;post;Publicités comparatives : 5 raisons de les éviter;Explorez 5 raisons pour lesquelles les publicités comparatives nuisent à l'image et à la crédibilité d'une entreprise. Lisez notre analyse complète dès maintenant.
111246;post;Sublime IDE : 5 extensions indispensables pour coder;Optimisez votre Sublime IDE avec 5 extensions essentielles pour booster votre productivité et personnaliser votre environnement de développement. Lisez notre guide complet !
110724;post;Présentation interactive : 3 étapes pour captiver l’audience;Transformez vos présentations en expériences interactives : apprenez à choisir le format idéal et à différencier discours et support pour captiver votre audience.
110482;post;FMOT : la première vérité des 4 moments du marketing;Explorez le FMOT, premier contact décisif entre consommateur et produit. Découvrez comment les 4 vérités influent sur l'achat et boostez votre stratégie marketing.
87021;post;Tofu, Mofu, Bofu : l’Inbound Marketing décrypté;Découvrez comment Tofu, Mofu et Bofu transforment l’Inbound Marketing pour booster vos conversions. Apprenez les clés du succès dès aujourd'hui !
86650;post;Growth design : redéfinissez votre site web;Apprenez comment le growth design révolutionne la conception de votre site en optimisant son évolution et sa performance. Lisez notre guide maintenant !
85942;post;Digital désir : 4 valeurs clés en inbound marketing;Maîtrisez les 4 valeurs clés du désir digital pour booster votre stratégie inbound marketing. Lisez notre guide complet pour tout savoir.
85994;post;Managéo : CPM bas coûts et la peur du display expliqués | 1min30;Explorez avec managéo le coût réel des CPM bas et l'appréhension du display. Analyse approfondie pour repenser vos campagnes publicitaires.
79301;post;Engagement client : 4 clés pour fidéliser vos clients;Boostez l'image de votre entreprise en renforçant l'engagement client. Apprenez 4 clés essentielles pour fidéliser et mieux connaître vos prospects.
85027;post;Bootstrapping CSS : simplifiez vos projets avec Bootstrap;Explorez bootstrapping CSS et découvrez comment Bootstrap peut améliorer vos projets web. Lisez notre analyse complète dès maintenant.
85014;post;CSS4 : la nouvelle ère du développement web;Explorez les innovations du CSS4 qui révolutionnent le codage et boostent votre rapidité. Apprenez comment améliorer vos projets web dès aujourd'hui.
5079;post;Carrousel Facebook : guide pour des pubs percutantes;Apprenez à exploiter le carrousel Facebook pour des campagnes visuelles percutantes. Nos conseils pratiques et astuces éprouvées vous mènent vers le succès.
1287500767;post;Mailing exemple : 6 éléments pour booster vos campagnes;Découvrez comment structurer vos mailings en 6 étapes clés pour renforcer l’impact de vos campagnes marketing. Suivez nos conseils de pro !
5433;post;Type d’humour en marketing : boostez votre communication;Apprenez à identifier le type d’humour idéal pour dynamiser votre communication. Astuces et conseils pour éviter les écueils et séduire votre audience.
79254;post;Kick-off meeting : 5 axes pour réussir votre projet;Apprenez comment le kick-off meeting structure vos objectifs et mobilise votre équipe. 5 conseils clés pour démarrer efficacement votre projet.
79464;post;Twitch.tv : streaming et gaming en direct;Explorez Twitch.tv, la première plateforme de livestreaming mondial. Accédez aux infos clés sur le gaming et les créateurs. Lisez notre présentation.
1287500765;post;Lien raccourci gratuit : top 7 outils sans inscription ni pub;Essayez un lien raccourci gratuit sans inscription ni pub. Comparez 7 outils pour économiser du temps, obtenir des statistiques et booster votre visibilité web.
78479;post;Trolls : comment les identifier et les combattre sur internet;Les trolls ne sont pas des mythes, ils sévissent en ligne. Apprenez à les identifier et neutraliser leur impact grâce à nos conseils pratiques.
77509;post;Socialblades : l'outil incontournable pour YouTube;Accédez aux statistiques clés de YouTube, Instagram et Twitch avec Socialblades. Obtenez des insights précis pour booster vos performances !
5532;post;Marronniers marketing : boostez votre stratégie éditoriale;Exploitez les marronniers marketing pour dynamiser votre contenu. Apprenez à intégrer ces temps forts et à attirer un public engagé.
77041;post;Morphing : définition et enjeux par 1min30;Le morphing transforme dessins et photographies en œuvres dynamiques. 1min30 détaille ses techniques innovantes et défis pour un résultat impressionnant.
76599;post;Mailing en Gmail : GSP, le format publicitaire natif innovant;Apprenez comment GSP, le format publicitaire natif de Gmail, bouscule le mailing en déclin et booste vos campagnes. Lisez notre analyse complète !
35492;post;Prezi : présentations interactives sans diapositives;Explorez Prezi, l’outil interactif qui vous permet de créer des présentations fluides et professionnelles. Apprenez son fonctionnement rapidement !
75616;post;CPC, CPM, CPA, CPL : comment choisir et investir;Apprenez à comparer CPC, CPM, CPA et CPL pour optimiser vos campagnes et investir judicieusement en webmarketing.
4700;post;Native ad : mode d’emploi – Astuces et guide;Tout savoir sur le native ad : apprenez à intégrer des publicités naturelles dans votre interface pour booster l’engagement. Lisez notre guide complet !
76087;post;PESO Model animé : stratégie digitale par 1min30;Découvrez le PESO Model expliqué par l'agence 1min30, experte en marketing digital. Optimisez votre communication et e-réputation avec des cas concrets.
35078;post;Identité visuelle : guide complet pour renforcer votre marque;Apprenez comment l'identité visuelle renforce la crédibilité et l'image de votre entreprise. Un atout essentiel pour se démarquer sur le marché.
34404;post;Le tracking : 5 astuces essentielles à connaître;Apprenez comment le tracking identifie votre audience et optimise vos campagnes digitales. Suivez nos 5 conseils pratiques !
309;post;Evernote c'est quoi ? 5 astuces pour une stratégie éditoriale;Découvrez comment Evernote booste votre productivité en centralisant vos idées et dynamise votre stratégie éditoriale. Guide illustré.
33695;post;Plateforme de marque exemple : créez votre identité;Apprenez comment une plateforme de marque exemplaire influence vos décisions et construit une identité forte. Lisez les 5 étapes clés.
256;post;Planning éditorial : boostez votre blog efficacement;Optimisez la publication de votre blog avec un planning éditorial structuré et simple. Apprenez les conseils d’experts pour dynamiser votre contenu.
11877;post;Webcoupon : convertissez et fidélisez efficacement vos clients;Boostez vos ventes grâce aux webcoupons. Accédez à nos offres exclusives pour améliorer vos conversions et fidéliser votre clientèle.
1287500803;post;Réseau social professionnel : top 8 pour votre entreprise;Explorez 8 réseaux sociaux essentiels, incluant le réseau social professionnel, pour dynamiser votre entreprise. Listing détaillé et conseils pratiques.
159;post;Entonnoir de prospection : 5 étapes pour booster vos ventes;Boostez vos ventes en optimisant votre entonnoir de prospection. Découvrez 5 étapes clés pour transformer vos visiteurs en clients dès aujourd’hui.
1287500799;post;Site d'entreprise : 7 sites web pour réussir;Vous hésitez sur le type de site pour votre entreprise ? Apprenez comment 7 modèles spécifiques peuvent booster votre présence en ligne.
30302;post;Marketing technologist : pilotez votre transformation digitale;Apprenez comment le marketing technologist révolutionne l'expérience client en intégrant data et technologies innovantes. Lisez pour booster votre stratégie.
30297;post;5P : la technologie redéfinit les fondations du marketing;Explorez comment la technologie transforme les 4P en 5P et redéfinit les fondements du marketing. Lisez 4 articles complets pour saisir cette évolution.
3735;post;Flickr c'est quoi ? Guide marketing pour débutants;Comprenez Flickr et apprenez à dynamiser votre marketing visuel grâce à des conseils pratiques pour fédérer votre communauté.
3757;post;WeChat : c'est quoi ? Guide marketing pour débutants;Explorez le fonctionnement de WeChat et boostez votre stratégie sur le marché chinois. Apprenez les bases pour débuter avec succès !
28909;post;Recommandations LinkedIn : boostez votre profil | Cadremploi;Apprenez comment obtenir des recommandations efficaces sur LinkedIn pour renforcer votre crédibilité et booster votre carrière. Lisez nos conseils pratiques !
28501;post;Exemples de pub Instagram : top 5 et meilleures pratiques;Révélez comment Instagram se transforme en plateforme publicitaire efficace. Apprenez des 5 exemples inspirants pour booster votre stratégie digitale.
28472;post;Chunking : la technique pour optimiser votre message;Apprenez comment le chunking organise l’information et améliore la mémorisation dans un contexte marketing surchargé. Lisez notre guide complet.
28408;post;Account-Based Marketing : définition et avantages;Apprenez comment l’Account-Based Marketing recentre votre stratégie sur des comptes-clés pour dynamiser vos conversions. Lisez notre guide complet pour tout comprendre.
3629;post;Mascotte marque : boostez votre image et notoriété;Apprenez comment une mascotte renforce l'image de votre marque grâce à des conseils concrets et des exemples percutants. Lisez notre guide complet !
28036;post;Clients fidèles : stratégies éprouvées et conseils clés;Fidéliser vos clients réduit vos coûts d’acquisition. Apprenez des techniques éprouvées et des conseils pratiques pour renforcer vos relations. Lisez notre guide !
27768;post;Social selling : guide ultime pour réussir;Découvrez le social selling : transformez vos réseaux en outils commerciaux performants. Apprenez à engager, convaincre et convertir efficacement vos prospects.
23105;post;Informatique code : guide des usages et infographie;Apprenez quels codes informatiques adopter pour un site, une appli mobile ou un jeu vidéo. L'infographie offre astuces et conseils pratiques.
27751;post;Buffer : planifiez et partagez vos contenus efficacement;Accédez à Buffer, l’outil incontournable pour planifier et partager vos contenus en toute simplicité. Essayez-le dès maintenant pour booster votre stratégie inbound.
1287500826;post;Emailing : choisir entre opt-in et opt-out;Perdu entre l'opt-in et l'opt-out ? Clarifiez les différences et trouvez la stratégie emailing qui booste vos acquisitions. Lisez notre infographie détaillée !
26525;post;ATAWAD : Révolutionnez vos applications dès aujourd'hui;Optimisez vos applications avec ATAWAD pour un accès au contenu innovant. Apprenez des astuces clés pour booster l'expérience utilisateur. Lisez notre guide complet !
26910;post;Blog et web : transformez votre blog en site performant;Transformez votre blog en site complet pour gérer efficacement votre activité en ligne. Réduisez les coûts et boostez votre visibilité digitale dès aujourd'hui !
26956;post;Data musicale : usages et tendances du streaming;Découvrez comment le streaming musical génère et exploite vos données pour booster votre stratégie. Apprenez à transformer ces insights en avantage.
26779;post;Raccourcis clavier Excel: boostez votre productivité;Explorez 17 raccourcis clavier Excel indispensables pour travailler plus vite et gagner en efficacité. Optimisez dès maintenant votre productivité !
26169;post;Entreprise omnicanal : 3 exemples inspirants;Découvrez 3 entreprises qui redéfinissent l’expérience omnicanal en alliant physique et digital. Lisez notre analyse pour booster votre stratégie !
26127;post;Service client Nike téléphone : succès sur réseaux sociaux;Découvrez comment le service client Nike téléphone combine réseaux sociaux et assistance rapide pour fidéliser sa clientèle et devancer la concurrence.
1287500823;post;Outreach marketing : boostez la portée de vos publications;Augmentez la visibilité de vos articles grâce à l’outreach marketing. Apprenez des astuces éprouvées et utilisez nos templates pour maximiser votre impact.
26063;post;Category Management : 8 étapes pour booster votre stratégie;Maîtrisez le category management en 8 étapes clés pour optimiser votre offre, fidéliser vos clients et performer sur le marché.
25256;post;TV storytelling : comment les séries l'utilisent pour capter l'attention;Apprenez comment le tv storytelling transforme l’univers des séries TV et capte l’attention du public. Lisez notre analyse détaillée !
11796;post;Outils de communication: top 5 pour visibilité locale;Apprenez comment les outils de communication locaux boostent la visibilité de votre entreprise. Lisez notre guide complet pour agir dès maintenant !
23917;post;Infographie définition : signification des couleurs;Comprenez l'infographie définition et l'impact des couleurs en webdesign. Apprenez à choisir la palette idéale pour renforcer votre identité graphique.
25563;post;Réserver un nom de domaine : guide rapide et efficace;Lancez votre site web en toute sérénité : suivez notre guide complet pour réserver votre nom de domaine rapidement et en toute sécurité.
24519;post;Creapills : boostez votre marketing space avec créativité;Essayez Creapills, l'outil innovant pour diffuser vos idées et concepts, et dynamiser votre marketing space dès aujourd'hui.
1287500817;post;Pricer votre offre : guide pour fixer le juste prix;Optimisez votre offre en fixant le juste prix. Apprenez à analyser les données clés pour pricer efficacement vos produits et maximiser vos profits.
24527;post;Auto-dérision : définition et force marketing;Apprenez comment l'autodérision transforme vos campagnes en misant sur l'humour pour captiver votre audience. Lisez notre guide complet.
24436;post;Marketing Space : coworking pour pros du marketing;Découvrez l'espace coworking dédié aux professionnels du marketing, un lieu innovant pour collaborer et créer ensemble.
23146;post;Newsjacking : 4 conseils pour exploiter l’actualité;Découvrez 4 conseils clés pour maîtriser le newsjacking et exploiter l’actualité afin de booster votre visibilité en ligne. Lisez notre guide complet !
22816;post;Support de présentation 2.0 : créez un Prezi percutant;Apprenez à concevoir un support de présentation 2.0 avec Prezi pour engager efficacement votre audience et convertir vos prospects. Lisez notre guide complet !
23596;post;Google display : boostez votre pub en ligne efficacement;Exploitez le Google Display Network pour multiplier vos formats visuels et booster vos conversions. Profitez de tarifs avantageux pour votre pub en ligne !
