id;type;seo_title;seo_description
1287502259;post;Marketing international : boostez votre impact global;Explorez la distinction entre marketing international et global, et apprenez à adapter votre stratégie pour conquérir de nouveaux marchés. Lisez notre analyse complète !
1287502266;post;Texte français à traduire en anglais : 10 conseils pratiques;Améliorez vos textes français à traduire en anglais grâce à ces 10 conseils. Rédigez des phrases concises et des constructions standards pour économiser du temps et de l'argent.
1287509478;post;Scale up : erreurs à éviter en phase d'accélération;Évitez les pièges du scale up pour booster votre développement. Découvrez les erreurs courantes à bannir pour réussir votre croissance.
1287508252;post;Boycott Amazon : Covid-19, impact sur les librairies;Face aux répercussions de Covid-19 sur les librairies, explorez les raisons du boycott Amazon et comprenez les enjeux e-commerce. Lisez notre analyse maintenant !
1287508545;post;Fiche de poste chef de projet : missions et compétences clés;Découvrez la fiche de poste complète pour un chef de projet idéal, regroupant missions, compétences et savoir-faire pour réussir vos projets.
1287506924;post;SPIN Selling : boostez vos ventes avec des questions efficaces;Apprenez comment le SPIN Selling transforme le processus commercial grâce à des techniques de questionnement éprouvées. Lisez notre guide complet !
1287508837;post;Origine Black Friday : histoire & secrets dévoilés;Comprenez l'origine du Black Friday et son impact mondial sur les ventes. Analyse complète et insights exclusifs pour en savoir plus.
1287499314;post;Billboard TV : définition et conseils pratiques;Découvrez le billboard TV, une animation sponsorisée de 6, 8 ou 12 secondes avant une émission. Apprenez à le concevoir pour maximiser son impact publicitaire.
1287503377;post;Devenez freelance en marketing digital : guide pratique;Passez du salariat à l'indépendance en marketing digital. Apprenez clés et conseils pour réussir votre reconversion professionnelle dès aujourd'hui !
1287502725;post;Agorapulse : guide ultime pour gérer vos réseaux;Maîtrisez Agorapulse pour centraliser vos interactions et dynamiser la gestion de vos réseaux sociaux. Lisez notre guide complet pour optimiser le travail en équipe.
1287502755;post;Site qui corrige les fautes : 5 outils indispensables;Améliorez vos articles grâce à 5 outils de correction performants. Testez dès maintenant ces solutions et obtenez un texte impeccable.
1287502206;post;Part de marché : stratégies pour une croissance efficace;Apprenez à booster votre part de marché grâce à des stratégies client ciblées. Suivez nos conseils pratiques dès aujourd'hui !
1287499109;post;Brief créatif : guide pratique pour le réussir;Apprenez à élaborer un brief créatif efficace avec notre guide pratique : définitions et conseils indispensables pour libérer votre créativité.
1287498375;post;Livre marketing : 10 incontournables du digital;Découvrez notre sélection exclusive de 10 livres marketing essentiels pour optimiser votre stratégie digitale. Investissez dans votre succès !
1287501960;post;Pubs Burger King : campagnes audacieuses à découvrir;Explorez les campagnes publicitaires innovantes de Burger King et laissez-vous surprendre par leur créativité. Lisez notre article pour en savoir plus.
1287501253;post;Lesoutrali : devenez love brand et fidélisez vos clients;Apprenez à transformer votre marque en love brand incontournable pour attirer et fidéliser vos clients. Lisez nos conseils stratégiques dès maintenant !
1287499308;post;Montage Instagram : 7 outils vidéo essentiels;Boostez vos stories Instagram avec 7 outils de montage vidéo pratiques. Testez-les dès aujourd'hui pour dynamiser vos contenus.
1287498935;post;Droit à la formation : tout savoir pour les salariés;Informez-vous sur le droit à la formation: développez vos compétences avec des formations continues et le CPF. Lisez notre guide complet dès maintenant!
1287498545;post;Webinarjam : guide pour intervenir en webinaire;Maîtrisez Webinarjam avec ce tutoriel complet pour intervenir en live. Suivez la checklist et prenez la parole en toute confiance.
1287497806;post;Histoire de la publicité : évolutions et étapes clés;Explorez l'évolution de la publicité, de l'Antiquité aux innovations modernes, et découvrez les étapes clés qui ont façonné son développement.
1287497367;post;Vendre des livres sur Amazon : guide essentiel;Amazon est le leader mondial de la vente en ligne. Apprenez comment vendre des livres sur Amazon en adoptant des stratégies éprouvées pour booster vos ventes.
1287497263;post;Super pubs 2020 : tops spots du Super Bowl;Le Super Bowl 2020, suivi par plus de 100 millions de téléspectateurs, dévoile des pubs marquantes. Analysez l'impact de ces spots dès maintenant.
1287496275;post;Le copywriting : boostez votre marketing de marque;Découvrez comment le copywriting crée des messages percutants et renforce votre marketing. Apprenez des techniques clés pour booster votre communication.
1287496580;post;Film advertising : top 10 films pour directeurs marketing;Explorez 10 films inspirants pour directeurs marketing et boostez votre créativité et vos campagnes publicitaires. Lisez notre sélection.
1287496334;post;Like Instagram : impacts de la disparition pour les entreprises;Analysez les répercussions commerciales et marketing de la disparition du like sur Instagram et ajustez votre stratégie pour rester compétitif.
1287495244;post;Agence Zen Marketing Toulouse : Profil idéal et formations;Vous rêvez de rejoindre une agence zen marketing à Toulouse ? Découvrez les compétences et qualités indispensables pour réussir et propulser votre carrière.
1287492475;post;Phygital en retail : 13 enjeux clés pour réussir;Apprenez à maîtriser les 13 enjeux de la transition phygitale et boostez votre stratégie retail pour offrir une expérience client optimale.
1287494427;post;Kakemono définition : origine et usage incontournables;Apprenez la définition du kakemono, support de communication incontournable, et son évolution des origines culturelles à son usage moderne au Japon.
1287492326;post;Responsable en ressources humaines : rôle essentiel en entreprise;Découvrez comment un responsable RH optimise le capital humain et accompagne le changement pour une entreprise performante. Lisez nos conseils pratiques !
1287492912;post;Centre de ressources : autoformation et conseils;Accédez à un centre de ressources complet : documents, tutoriels et conseils pratiques pour booster votre autoformation. Lisez nos astuces !
1287491908;post;MQL vs SQL : différences essentielles en prospection;Apprenez à différencier MQL et SQL pour optimiser votre prospection. Découvrez comment chaque stade transforme un lead en client engagé.
1287490860;post;Demand Generation : stratégies d'acquisition innovantes | 1min30;Explorez comment la demand generation dynamise l'acquisition et la fidélisation client grâce à des stratégies marketing innovantes. Lisez notre guide dès maintenant !
1287490625;post;Traduction du site : outils pour booster votre notoriété;Boostez votre entreprise grâce à une traduction professionnelle. Profitez d’outils performants pour étendre votre audience et gagner de nouveaux marchés.
1287490537;post;ROI marketing : calculez votre retour sur investissement;Apprenez à calculer votre ROI marketing pour optimiser vos campagnes et booster la rentabilité. Lisez notre guide complet.
1287490512;post;Facebook Live : guide pratique pour réussir votre live;Boostez vos ventes grâce à Facebook Live en suivant notre guide pratique. Apprenez à créer des vidéos en direct captivantes et efficaces.
1287485751;post;Marque drôle : 8 succès grâce à l'humour;Découvrez comment 8 grandes marques transforment leur image avec l'humour pour captiver leur audience. Apprenez leurs stratégies dès maintenant !
1287485812;post;videos stream : boostez votre communication en direct;Apprenez à exploiter la vidéo en direct (videos stream) pour dynamiser votre communication et fidéliser vos clients. Lisez notre guide.
1287488998;post;Directeur en marketing : rôle, missions et enjeux;Apprenez comment le directeur en marketing, pilier stratégique, combine analyse et management pour optimiser la performance de l’entreprise.
1287488989;post;DCO marketing : définition, avantages et pratiques;Apprenez à employer la DCO marketing pour booster vos campagnes publicitaires grâce à la personnalisation dynamique des visuels. Lisez notre guide complet.
1287488986;post;Data Scientist : définition et enjeux;Comprenez le rôle stratégique du Data Scientist, de l'analyse des données à la prise de décision. Apprenez ses enjeux essentiels.
1287488895;post;OKR : guide complet pas à pas pour réussir;Maîtrisez l’OKR pour définir des objectifs clairs et mesurables. Suivez notre guide étape par étape pour dynamiser les performances de votre entreprise.
1287488892;post;Infographiste définition : les secrets d'un métier créatif;Apprenez comment un infographiste fusionne textes, couleurs et images pour un contenu visuel percutant. Lisez notre guide complet pour en savoir plus.
1287486034;post;Proposition de valeur : définition et conseils clés;Mettez en lumière votre marque avec une proposition de valeur forte. Apprenez à la définir pour attirer vos clients dès aujourd'hui.
1287485969;post;A/B split test : boostez la conversion de votre site;Apprenez comment l’A/B split test améliore la performance de votre site et augmente significativement votre taux de conversion grâce à des outils éprouvés.
1287486004;post;Inbound marketing & automation : une synergie gagnante;Apprenez comment combiner l'automation et l'inbound marketing pour attirer plus de prospects et booster votre engagement avec des stratégies éprouvées.
1287485995;post;Qu’est-ce que la communication : enjeux et méthodes | 1min30;Apprenez l’importance de la communication en entreprise pour renforcer l’image de marque et stimuler le développement. Lisez notre guide complet !
1287485991;post;La vente : stratégies efficaces pour booster vos résultats;Boostez la croissance de votre entreprise grâce à la vente. Apprenez des techniques commerciales éprouvées et distinguez-la du marketing.
1287485797;post;Biographie professionnelle : rédigez une bio qui convertit;Apprenez 6 conseils pratiques pour transformer votre bio professionnelle en un puissant levier de prospection. Optimisez votre image et attirez plus de prospects.
1287485706;post;Google Search Console : boostez votre SEO;Google Search Console est un tableau de bord complet pour analyser et optimiser votre référencement. Améliorez votre stratégie web dès aujourd’hui !
1287485703;post;La digitale QR code : boostez votre communication interactive;Intégrez la digitale QR code pour dynamiser votre communication. Apprenez comment élargir votre audience avec une stratégie interactive et moderne.
1287485331;post;Community manager français : profils et missions clés;Apprenez à repérer les meilleurs community managers français et découvrez leurs compétences essentielles pour dynamiser votre image sur les réseaux sociaux.
1287485325;post;Scalabilité : définition et atouts clés | 1min30;Comprenez la scalabilité et ses enjeux pour une croissance agile. Apprenez à optimiser vos processus et à performer en période d’expansion.
1287484571;post;Différence entre marketing et communication : maîtrisez l'enjeu;Comprenez la distinction entre marketing et communication grâce à notre analyse concise. Clarifiez vos stratégies dès aujourd'hui !
1287485397;post;Jobs to be done : méthode ultime pour comprendre vos clients;Comprenez les besoins réels de vos clients avec la méthode Jobs to be done. Astuces, définitions et conseils pour optimiser votre offre.
1287480765;post;Branding définition : guide complet du brand marketing;Explorez comment le brand marketing construit l’identité d’une marque et renforce sa présence sur le marché. Lisez notre guide complet pour tout savoir !
1287481177;post;Gary Vaynerchuk : le guru du business décrypté;Explorez Gary Vaynerchuk (Gary Vee), entrepreneur visionnaire. Histoire, stratégies et vision innovante du marketing digital pour transformer votre business.
1287480723;post;Reddit : guide complet de la page d’accueil d’Internet;Explorez Reddit, plateforme phare d’Internet. Apprenez à utiliser ses fonctionnalités et à rejoindre des communautés dynamiques.
1287478771;post;Marketing produit : définition, enjeux et stratégies gagnantes;Comprenez le marketing produit et ses enjeux clés pour réussir sur le marché. Adoptez des stratégies gagnantes et boostez votre compétitivité dès aujourd’hui !
1287478691;post;Marketing opérationnel : définition et applications | 1min30;Apprenez comment le marketing opérationnel associe techniques pratiques et actions ciblées pour booster vos ventes et atteindre vos objectifs commerciaux. Lisez notre guide complet.
1287479767;post;Hunt a Killer : box d'enquête immersive en France;Explorez l'univers des enquêtes immersives avec Hunt a Killer et d'autres box innovantes. Inspirez-vous pour créer votre propre expérience d'enquête en France !
1287475771;post;Formats vidéo YouTube : TrueView InStream & OutStream;Apprenez à exploiter les formats vidéo YouTube et boostez votre pub. TrueView InStream & OutStream, des solutions performantes pour capter l'attention. Lisez le guide !
1287478549;post;Marketing mix : définition et clé de réussite - 1min30;Du 4P au 7P, le marketing mix s’impose comme l’outil indispensable pour réussir. Apprenez à harmoniser produits, prix, promotion et distribution pour booster votre business.
1287478443;post;Karl Lagerfeld jeune : le Kaiser de la photo de mode;Plongez dans l'univers de Karl Lagerfeld jeune, le 'Kaiser' de la photo de mode, et explorez l'influence d'Irving Penn, Helmut Newton et Guy Bourdin.
1287478287;post;exemple d'e-mailing prospection : boostez vos leads;Maîtrisez l’e-mailing prospection commerciale. Apprenez à rédiger des messages percutants respectant les règles anti-spam et générant des leads.
1287477671;post;Facteurs clés de succès : comment les déterminer efficacement;Apprenez à identifier et optimiser les leviers stratégiques essentiels pour booster votre plan marketing et atteindre vos objectifs.
1287478121;post;RCU : mettre en place un référentiel client unique dans une CDP;Découvrez comment intégrer un RCU dans une CDP, centralisez vos données et boostez votre transformation digitale.
1287475063;post;Définir sa ligne éditoriale : guide et conseils pratiques;La ligne éditoriale est le cœur de votre stratégie de contenu. Apprenez à la définir et à fixer des objectifs clairs pour maximiser votre impact.
1287473692;post;PR marketing : inbound pour revitaliser vos RP | Agence 1min30;Apprenez comment l'inbound marketing modernise le pr marketing pour des relations publiques dynamiques. Lisez nos conseils pour booster votre impact digital.
1287474733;post;Curation de contenu : outils incontournables;Partagez et valorisez des contenus tiers pour enrichir votre stratégie inbound. Apprenez à exploiter des outils de curation performants.
1287474107;post;Google Suggest : boostez votre visibilité en -1 | 1min30;Apprenez comment Google Suggest permet à votre marque d’apparaître en position -1 dans les recherches Google, augmentant ainsi sa visibilité dès le premier regard.
1287473904;post;CDP marketing : différences DMP, CDP et CRM | Agence 1min30;Comprenez comment la CDP marketing se distingue des DMP et CRM pour booster votre stratégie digitale. Astuces et conseils pratiques à découvrir.
1287473112;post;Watch Time sur YouTube : boostez l'engagement;Focus sur le Watch Time, critère essentiel sur YouTube. Apprenez à optimiser vos vidéos pour améliorer l’engagement et la performance.
1287470222;post;Design émotionnel : susciter l'émotion pour gagner des clients;Apprenez comment le design émotionnel stimule les émotions et engage vos utilisateurs pour convertir des visiteurs en clients fidèles.
1287473110;post;Instream YouTube : le format pub indispensable | Agence 1min30;Comprenez le format instream de YouTube, la publicité diffusée avant, pendant ou après les vidéos, et boostez votre stratégie marketing.
1287471818;post;Amazon création : comment Amazon a tout changé;Examinez la transformation d’Amazon : du premier livre aux innovations retail. Apprenez comment l’idée d’amazon création a révolutionné le commerce.
1287472312;post;Format vidéos YouTube : pub Discovery TrueView | 1min30;Apprenez à utiliser le format vidéos YouTube Discovery TrueView pour capter l'attention de vos internautes. Lisez notre guide complet !
1287471512;post;Enjeu d'un projet : réussir sa gestion;Maîtrisez les enjeux essentiels pour garantir le succès de votre gestion de projet. Profitez de conseils concrets et de stratégies éprouvées dès aujourd'hui.
1287471270;post;Campagne marketing : 7 succès à 30M vues;Apprenez comment 7 campagnes marketing ont généré plus de 30 millions de vues et boosté leur notoriété. Lisez notre analyse complète dès maintenant !
1287471304;post;KPIs MKT : Mesurez votre marketing digital | Agence 1min30;Apprenez à choisir les KPIs adaptés pour optimiser votre stratégie digitale. Mesurez vos performances et boostez vos actions marketing efficacement.
1287469445;post;La règle des 3R : boostez votre valeur | 1min30;Boostez votre valeur de marque avec la règle des 3R : retour sur investissement, image et interactivité. Lisez notre analyse complète !
1287471302;post;Full remote : adoptez une organisation agile | Agence 1min30;Réinventez votre management avec le full remote, méthode agile aux bénéfices éprouvés pour transformer votre entreprise. Lisez notre guide.
1287465345;post;Marque ombrelle : types et fonctions | Agence 1min30;Explorez la marque ombrelle et ses fonctions: noms, signaux et stratégies pour valoriser vos produits. Lisez notre guide complet pour booster votre image.
1287470272;post;Vidéo lumière : comprendre et maîtriser l'éclairage | 1min30;L'éclairage est essentiel pour des vidéos percutantes. Apprenez à utiliser la lumière pour valoriser vos contenus. Consultez nos conseils experts dès maintenant !
1287471666;post;Marketing : définition et utilité expliquées;Le marketing, c’est l’art de positionner un produit ou service sur le marché. Apprenez les stratégies et actions clés pour réussir.
1287463681;post;Sponsoring Red Bull : marketing des sports extrêmes | Agence 1min30;Explorez comment le sponsoring Red Bull révolutionne le marketing sportif et inspire les passionnés d'extrêmes. Lisez notre analyse approfondie !
1287470448;post;Business Model : 10 types pour réussir | Agence 1min30;Découvrez comment choisir le business model idéal pour transformer votre projet en succès. Stratégies efficaces et conseils pratiques à mettre en œuvre dès aujourd'hui !
1287467221;post;TubeBuddy : boostez rapidement votre chaîne YouTube;Accédez à TubeBuddy, l'outil tout-en-un pour optimiser vos vidéos et dynamiser votre chaîne YouTube. Essayez-le dès maintenant !
1287468745;post;SIAL définition : 7 ingrédients du succès à Paris 2018;Découvrez la définition du SIAL Paris 2018 et ses innovations, avec 2355 produits présélectionnés révélant les tendances incontournables en alimentation.
1287467107;post;Franchises salon : boostez votre réseau | 1min30;Participez au salon des franchises pour dynamiser votre réseau et explorer de nouvelles opportunités. Lisez nos conseils pratiques pour réussir votre présence.
1287463719;post;L'homme augmenté : futur tech et transhumanisme | 1min30;Apprenez comment le transhumanisme propulse l'homme augmenté pour dépasser limites physiques et intellectuelles. Lisez notre analyse complète !
1287462417;post;Animation SVG efficace : créez avec dynamics.js | Agence 1min30;Apprenez à créer une animation SVG percutante avec dynamics.js, une librairie puissante pour animer vos vecteurs. Lisez notre guide dès maintenant !
1287461789;post;Pyramide de Keller : décryptage du capital de marque;Explorez la pyramide de Keller pour comprendre et développer votre capital de marque. Apprenez à bâtir des relations authentiques avec vos clients.
1287462841;post;Micro-learning : formations pro innovantes | Agence 1min30;Découvrez comment le micro-learning révolutionne la formation pro grâce à une méthode concise, efficace et accessible partout. Suivez notre guide dès maintenant.
1287463027;post;Personnalité type : comprendre et utiliser | 1min30;Apprenez comment la personnalité type influence nos croyances limitantes et découvrez des stratégies pour optimiser son usage en entreprise.
1287462815;post;PR public: méthodologie inbound pour booster votre image;Apprenez comment l’Inbound PR optimise votre stratégie de communication et renforce l’image de marque grâce à des techniques éprouvées. Lisez notre guide complet !
1287460335;post;3D sur le web : maîtrisez THREE.js | 1min30;Découvrez comment implémenter de la 3D sur votre site avec THREE.js. Apprenez à créer des expériences interactives uniques dès aujourd'hui.
1287462337;post;Test psychologique de personnalité : déterminez votre profil;Explorez le test psychologique de personnalité pour analyser vos traits et dépasser vos croyances limitantes. Apprenez comment le MBTI peut vous éclairer.
1287459399;post;BEM CSS : optimisez votre code avec SMACSS;Boostez l'organisation de votre CSS avec BEM et SMACSS. Apprenez à structurer votre code pour plus de maintenabilité et performance. Lisez notre guide complet.
1287458647;post;LinkedIn Ads : ciblage précis pour vos campagnes B2B;Découvrez LinkedIn Ads, la plateforme B2B offrant un ciblage précis et fiable pour optimiser vos campagnes publicitaires. Essayez-la dès aujourd'hui !
1287458831;post;Argumentaire de vente : étapes clés pour convaincre;Apprenez à construire un argumentaire de vente percutant en alliant offre, entreprise et attentes clients. Suivez nos conseils avisés pour convaincre !
1287461011;post;Anchoring : maîtrisez l'art de fixer vos prix | Agence 1min30;Apprenez comment l'anchoring modifie la perception des prix et augmente votre marge. Lisez notre analyse détaillée pour booster vos ventes.
1287460047;post;ManyChat et Facebook Messenger : boostez votre marketing;Apprenez comment Facebook Messenger et ManyChat transforment votre stratégie marketing. Inscrivez-vous au webinaire pour maîtriser les bots.
1287455477;post;Diplôme en ligne : certifiez-vous sans retourner aux bancs;Optez pour un diplôme en ligne accessible et reconnu. Réinventez votre carrière sans retourner en classe grâce à une formation innovante.
1287455221;post;Identité de marque: physique & prisme de kapferer;Comprenez comment l'identité de marque se construit grâce au prisme de Kapferer et au physique. Optimisez votre stratégie dès aujourd'hui !
1287455307;post;Editeur de texte : choix optimal pour développeurs web;Optimisez votre développement web grâce à un éditeur performant. Comparez Visual Studio Code, Atom et bien d’autres pour booster votre productivité.
1287454721;post;Caméra vidéo YouTube : guide d'achat pour débutants;Choisissez votre première caméra vidéo pour YouTube grâce à nos conseils pratiques et astuces pour vidéastes débutants. Lisez notre guide complet maintenant !
1287455039;post;Audit SEO : analysez votre site pour booster votre référencement;Boostez votre référencement naturel grâce à un audit SEO complet. Analysez votre site et optimisez vos éléments on-page pour des résultats durables.
1287454771;post;ManageWP vs MainWP : comparatif de monitoring de sites web;Comparez ManageWP et MainWP pour surveiller et piloter vos sites web efficacement. Lisez notre analyse pour une gestion simplifiée.
1287455373;post;Hypercroissance : définition, enjeux et conseils;Découvrez ce qu'est l'hypercroissance et ses enjeux pour les startups. Notre guide répond aux 5 questions clés pour réussir votre scale-up.
1287452401;post;Solution CRM : optimiser votre prospection commerciale;Boostez votre prospection commerciale avec une solution CRM performante. Apprenez à choisir l’outil idéal pour dynamiser votre relation client dès aujourd’hui.
1287441505;post;Vend machine efficace : créez votre stratégie d'automation;Apprenez à concevoir une vend machine performante pour automatiser votre marketing et booster vos ventes. Suivez nos étapes clés dès aujourd'hui !
1287451903;post;Segmentation clients : comprendre et réussir votre stratégie;Apprenez à maîtriser la segmentation clients pour cibler efficacement vos prospects avec des conseils et astuces marketing pratiques.
7151;post;Jeux concours gagnants : 5 formats social media à tous les coups;Boostez votre visibilité sur les réseaux sociaux grâce aux jeux concours. Lisez notre guide sur 5 formats social media gagnants à tous les coups pour maximiser l'engagement.
1287448327;post;Concept SAVE : repenser le marketing au-delà des 4P;Adoptez le concept SAVE pour remplacer le modèle 4P et boostez votre stratégie marketing grâce à une méthode innovante.
127559;post;Cross-média : réinventer la communication papier;Découvrez comment les imprimeurs adoptent le cross-média pour redéfinir la communication papier et toucher un public multicanal. Lisez notre analyse.
111779;post;Agent photographe : 3 raisons pour booster vos campagnes;Apprenez comment un agent photographe optimise vos campagnes par son expertise en éclairage et cadrage. Lisez nos conseils experts !
