id;type;seo_title;seo_description
20395;post;Ads express : boostez vos campagnes avec Google Adwords Express;Boostez votre visibilité publicitaire grâce à Google Adwords Express. Gérez vos annonces en toute simplicité et atteignez vos clients. Essayez dès maintenant!
1287500814;post;qzone & 9 autres réseaux sociaux essentiels pour l'international;Adoptez une stratégie de webmarketing international en intégrant Qzone et d'autres réseaux incontournables pour toucher des cibles locales. Lisez notre guide.
21262;post;Anniversaire d'entreprise : 5 raisons de le célébrer;Apprenez comment l'anniversaire d'une entreprise renforce l'esprit d'équipe et valorise votre image grâce à 5 raisons incontournables de le fêter.
21708;post;Workshop def : 5 conseils pour réussir votre atelier;Maîtrisez l'art du workshop avec 5 conseils essentiels. Apprenez à définir votre audience et structurer votre atelier pour un succès garanti.
1287500811;post;Idée pop up : 11 astuces pour annoncer votre évènement en ligne;Apprenez à utiliser des pop ups pour annoncer et promouvoir votre évènement. Stratégies efficaces pour capter l'attention et booster votre succès en ligne !
20405;post;Datananas testé : logiciel de listes prospects B2B | 1min30;Testez Datananas sur 1min30 : un outil innovant pour créer rapidement des listes de prospects B2B à partir de LinkedIn et Viadeo. Lisez notre avis.
21265;post;Geofencing : définition & conseils pour réussir;Découvrez le geofencing, technologie innovante pour envoyer des notifications ciblées selon la géolocalisation. Apprenez à optimiser vos campagnes mobiles.
1287500810;post;Insatisfactions client : gérez efficacement votre e-réputation;Améliorez votre image en gérant intelligemment les insatisfactions client sur le web. Suivez nos stratégies et astuces pour transformer critiques en opportunités.
20036;post;Définition post mortem : guide complet de rédaction;Découvrez la définition et les astuces pratiques pour rédiger un post mortem efficace et analyser vos projets.
1287500809;post;Tarif presse : combien coûte un article de blog ?;Informez-vous sur le tarif presse et comprenez comment les agences fixent le prix d'un article de blog. Analyse des critères essentiels et conseils pratiques.
19902;post;Marketing Space : coworking innovant pour les pros | 1min30;Explorez le Marketing Space d’1min30, espace coworking dédié aux métiers du marketing, offrant un environnement moderne pour stimuler votre créativité.
18758;post;SEMrush : évaluation du logiciel d'audit de sites | 1min30;Test de SEMrush par 1min30 : analysez cet outil d'audit web et boostez la performance de votre site.
1287500910;post;Offre de lancement : 5 actions clés à mener;Planifiez votre offre de lancement en toute sérénité. Apprenez 5 actions indispensables pour préparer et promouvoir votre produit avant sa sortie sur le marché.
18153;post;ROI marketing : retour sur investissement expliqué;Comprenez le ROI marketing, indicateur essentiel pour mesurer l'efficacité de vos investissements. Méthodes de calcul et astuces pour booster vos résultats dès aujourd'hui.
14006;post;Outils de communication interne : 6 leviers efficaces;Boostez votre communication interne avec 6 outils essentiels pour engager vos équipes et favoriser la collaboration. Lisez notre guide complet. Agissez maintenant!
13136;post;Freemium : stratégie gagnante pour booster vos revenus;Apprenez pourquoi le freemium est un modèle économique innovant qui transforme vos utilisateurs en clients payants. Lisez notre guide complet pour maximiser vos gains.
12533;post;E-merchandiser : missions et compétences clés;Apprenez comment l’e-merchandiser révolutionne l’e-commerce en définissant missions et compétences essentielles pour réussir dans ce métier innovant.
328;post;Proposition de valeur: 3 étapes pour convaincre;Différenciez-vous de vos concurrents avec 3 étapes clés pour rédiger une proposition de valeur efficace. Lisez notre guide complet !
16559;post;Exemples de QR Code cross-canal : 10 idées inspirantes;Découvrez 10 exemples concrets d'utilisation des QR Codes cross-canaux pour dynamiser vos campagnes marketing et booster l'engagement client.
12428;post;Reco stratégique d'agence : 5 clés pour réussir;Optimisez votre reco stratégique d'agence avec 5 clés pratiques pour convaincre vos prospects et transformer une approche complexe en succès assuré.
12490;post;Responsable éditorial web : rôle, compétences et enjeux;Apprenez tout sur le métier de responsable éditorial web : missions, compétences clés et opportunités dans l'e-commerce. Boostez votre stratégie digitale !
12123;post;Top 12 des sites pour annoncer efficacement;Explorez le top 12 des sites incontournables pour annoncer efficacement. Astuces et comparatif pour choisir la plateforme adaptée à votre audience.
12280;post;Viralité : 10 conseils clés pour une vidéo percutante;Apprenez 10 conseils pratiques pour booster la viralité de votre vidéo et générer un bouche-à-oreille efficace. Lisez notre guide dès maintenant !
13330;post;Sites de ventes privées : comparatif & tendances 2025;Analysez le fonctionnement des sites de ventes privées et comparez les meilleures plateformes. Profitez d’un guide complet pour optimiser votre ecommerce !
1287500900;post;Pop up : boostez votre site et générez des leads;Apprenez à utiliser les pop up pour optimiser votre conversion et générer rapidement des leads. Lisez nos astuces pratiques.
12358;post;5 techniques indispensables pour booster vos vues sur YouTube;Apprenez 5 stratégies puissantes pour dominer YouTube et multiplier vos vues. Passez à l'action et boostez votre audience dès aujourd'hui !
12261;post;Content manager : rôle et compétences pour booster votre succès;Comprenez le rôle clé d'un content manager alliant marketing digital et expertise web. Apprenez à optimiser votre communication en ligne !
11982;post;USP : maîtrisez votre avantage marketing unique;Valorisez votre stratégie avec une USP efficace. Apprenez les 3 critères essentiels pour créer une proposition de vente unique et impactante.
11825;post;How, What, Why : boostez votre marque avec le Golden Circle;Transformez votre stratégie avec le Golden Circle de Simon Sinek. Apprenez comment le modèle How, What, Why peut propulser votre marque dès aujourd'hui.
1287500896;post;Twitter Analytics : maîtrisez vos performances;Analysez vos tweets avec Twitter Analytics et optimisez votre stratégie. Apprenez à décrypter les statistiques pour booster votre présence.
1287500895;post;Soft bounce : comprendre l’emailing et éviter les erreurs;Optimisez vos campagnes emailing en maîtrisant soft bounce et hard bounce. Apprenez à corriger ces erreurs pour améliorer la délivrabilité de vos messages.
11254;post;Ellicible : benchmark des bases mails B2B;Comparez les fournisseurs de bases mails B2B et trouvez la solution ellicible idéale pour booster vos campagnes marketing. Lisez notre comparatif complet !
10932;post;Placement de produit : définition & réglementation;Apprenez à identifier les 4 formes de placement de produit – classique, institutionnel, évocateur, furtif – et à respecter leur cadre légal pour une communication efficace.
10833;post;Brand protection : 4 clés pour protéger votre image;Assurez la protection de votre marque en définissant des paramètres de sécurité efficaces pour vos campagnes digitales. Apprenez à éviter les risques dès aujourd'hui !
1287500890;post;Bannière Twitter : créez vos visuels réseaux sociaux facilement;Optimisez votre image en ligne avec une bannière Twitter percutante. Apprenez à créer des visuels efficaces grâce à des astuces et outils simples.
10228;post;Stumbleupon : veille web réinventée;Comprenez comment Stumbleupon révolutionne la veille web grâce à une plateforme innovante et interactive pour explorer l'inattendu. Lisez notre analyse !
12001;post;Lead scoring : accélérez votre Time to Value;Optimisez votre marketing automation avec le lead scoring. Profitez d'un suivi précis et d'un reporting efficace pour accélérer rapidement votre Time to Value.
1287500888;post;Double opt-in : succès garanti en emailing;Optimisez votre emailing grâce au double opt-in. Apprenez comment cette méthode renforce la qualité des contacts et booste vos taux d'ouverture.
10990;post;Inside videos : couleurs et stratégie - épisode Chanel;Explorez le dernier épisode de la saga Inside Chanel, dédié aux couleurs et à la stratégie de contenu. Regardez maintenant !
11556;post;Première page sur Google : 5 étapes essentielles;Maîtrisez votre SEO avec 5 étapes clés pour positionner votre site en première page sur Google et attirer plus de clients.
11588;post;Sponsor Tour de France : 3 avantages marketing clés;Boostez votre visibilité avec le sponsoring du Tour de France. Explorez 3 avantages marketing pour une campagne globale et un impact local remarquable.
269;post;Courts ou longs ? Choisissez le format idéal pour votre blog;Analysez les performances des contenus courts et longs pour maximiser l'engagement de vos articles. Lisez notre guide pour adopter la meilleure stratégie.
8500;post;TTFB : comprenez et optimisez votre Time To First Byte;Comprenez le TTFB (Time To First Byte) et son impact sur la vitesse de chargement. Apprenez à l’optimiser pour booster votre performance web.
1287500877;post;ZMOT : optimisez votre présence web & boostez vos conversions;Apprenez comment le ZMOT révolutionne le parcours d'achat en ligne et optimisez votre présence digitale pour augmenter vos conversions.
10019;post;Affiche burger king : oser, offenser, s’excuser;Analysez l'affiche Burger King et son marketing provocateur. Sexisme ou stratégie audacieuse? Lisez notre décryptage pour comprendre son impact.
206;post;Mail list : 4 étapes pour créer votre audience;Construisez une mail list efficace en 4 étapes. Apprenez à constituer et actualiser votre base de données pour des campagnes d’emailing performantes.
9099;post;Buyer persona : 5 étapes clefs pour définir vos clients;Apprenez à définir votre buyer persona en 5 étapes pratiques pour mieux cibler vos clients et booster votre content marketing dès aujourd'hui.
6474;post;Parrainage, sponsoring, mécénat : conseils pratiques;Explorez nos astuces pour réussir vos campagnes de parrainage, sponsoring et mécénat. Boostez votre visibilité et renforcez votre impact marketing.
6641;post;Header site web : définition et optimisation;Tout savoir sur le header d'un site web : composition, exemples et conseils pratiques pour optimiser l'expérience utilisateur.
1287500859;post;Persona exemple : vidéo des buyer persona de La Mie Câline;Inspirez-vous avec ce persona exemple efficace. Regardez en vidéo comment La Mie Câline analyse ses clients pour dynamiser votre stratégie marketing.
8243;post;Showroom retour : l'outil incontournable des RP mode;Apprenez comment le showroom retour dynamise l'exposition en RP mode et booste la communication des clients.
8266;post;FAQs : comprendre et rédiger votre FAQ efficace;Tout savoir sur les FAQs : définition, utilité en service client et SEO, et conseils pour les rédiger efficacement. Lisez notre guide complet !
8197;post;Flagship store : l'outil CRM innovant;Explorez comment les flagship stores se transforment en véritables outils de CRM, renforçant image de marque et expérience client. Lisez notre analyse complète.
8165;post;Tumblr c'est quoi ? Micro-blogging pour influenceurs;Comprenez Tumblr, service de micro-blogging innovant offrant des contenus personnalisés. Lisez notre guide pour exploiter son potentiel influenceur.
6416;post;Slideshare : astuces pour dynamiser votre contenu;Exploitez Slideshare pour booster votre stratégie de contenu. Profitez d'astuces pratiques et de conseils essentiels pour valoriser vos présentations.
1287500916;post;Twitter : 10 définitions indispensables;Apprenez à maîtriser le vocabulaire Twitter avec 10 définitions essentielles. Un glossaire illustré pour comprendre twittos, tweets et retweets. Lisez notre guide complet !
6362;post;Révolutionnez votre marketing avec la reconnaissance d'image;Découvrez comment la reconnaissance d'image, propulsée par le mobile, transforme les stratégies marketing et ouvre de nouvelles opportunités. Lisez notre guide complet.
7804;post;Scoop.it for Business : dynamisez vos relations presse;Exploitez Scoop.it for Business pour revitaliser vos relations presse et optimiser votre communication digitale. Apprenez nos astuces pratiques !
7627;post;Lignes de code : nombre par application [Infographie];Explorez cette infographie captivante classant les applications selon leur nombre de lignes de code et découvrez comment chaque projet se distingue.
6340;post;Relations presse : stratégies et outils indispensables;Boostez vos relations presse en adoptant des conseils pratiques et des outils indispensables pour établir des liens stratégiques avec les médias. Lisez notre guide complet dès maintenant.
6439;post;Google Ads : comprendre AdWords, AdSense & AdX;Comparez Google Ads et apprenez comment AdWords satisfait les annonceurs tandis qu'AdSense et AdX maximisent la monétisation. Lisez notre guide complet.
6337;post;Relations publiques : notions clés pour votre image;Maîtrisez l'art des relations publiques pour instaurer la confiance et renforcer votre image. Guide des notions essentielles pour réussir votre communication.
6593;post;Street marketing : 10 pratiques ayant fait le buzz;Explorez 10 exemples concrets de street marketing ayant captivé le public. Apprenez des stratégies efficaces pour dynamiser vos promotions en événementiel !
6555;post;Micro-site web : conseils, exemples et stratégie;Découvrez les avantages d’un micro-site web, ses usages et stratégies. Apprenez à créer un complément efficace à votre site principal.
6883;post;Marketeur moderne : infographies essentielles pour réussir;Explorez 2 infographies en anglais illustrant le profil hybride du marketeur moderne, mi-artiste, mi-scientifique. Apprenez à vous démarquer dès aujourd'hui !
6484;post;Bulletin d’information institutionnel : guide pratique;Optimisez votre communication avec un bulletin d’information bien rédigé. Apprenez nos astuces claires pour capter l’attention de vos publics.
6651;post;Parallax : principe et exemples inspirants;Le parallax crée un effet immersif en apportant profondeur et fluidité à votre site. Apprenez son fonctionnement et explorez des exemples concrets.
6639;post;Footer : tout savoir sur son rôle et sa composition;Le footer, situé en bas de page, fournit des informations essentielles et liens clés. Apprenez comment optimiser cette zone pour améliorer l'expérience utilisateur.
7409;post;Inside Chanel : exemple inspirant de brand content;Plongez dans Inside Chanel, campagne en 9 vidéos retraçant l'histoire de Coco Chanel et révélant une stratégie de brand content révolutionnaire. Apprenez dès maintenant.
6426;post;Dailymotion : optimisez votre stratégie vidéo;Apprenez à tirer parti de Dailymotion pour dynamiser votre communication vidéo. Suivez nos conseils pratiques pour captiver votre audience.
6377;post;Code flash : guide des avantages et limites;Boostez votre marketing en intégrant le code flash. Analysez ses avantages, limites et usages pour dynamiser vos campagnes.
6345;post;Retargeting : conseils, étapes et inconvénients;Maîtrisez le retargeting pour optimiser votre publicité en ligne. Apprenez les étapes clés, bénéficiez de conseils pratiques et identifiez les limites de chaque campagne.
6322;post;Animation site web : boostez votre trafic avec des contenus dynamiques;Boostez votre trafic et votre communication online grâce à une animation site web efficace. Apprenez à créer des contenus dynamiques et engageants.
6277;post;Mass media : comprendre la pub sur les médias de masse;Explorez les stratégies publicitaires sur les médias de masse (TV, radio, presse, affichage, etc.) et apprenez comment elles transforment votre communication.
6217;post;Marketing éthique : origine et exemples clés | 1min30;Comprenez comment le marketing éthique transforme la stratégie d’entreprise. Apprenez son origine et explorez des exemples inspirants pour adopter une démarche responsable.
6104;post;Magasins Stradivarius : merchandising créatif et captivant;Le merchandising transforme vos boutiques en expériences uniques. Explorez comment les magasins Stradivarius en Espagne réinventent l'accueil client.
6234;post;Linkedin c'est quoi ? Stratégies et avantages;Comprenez Linkedin, réseau professionnel incontournable. Apprenez à l'utiliser pour booster votre communication et convertir vos prospects.
6159;post;Co-branding : pratiques et exemples concrets;Apprenez comment le co-branding renforce l'image de deux marques par des partenariats gagnants. Explorez stratégies et exemples efficaces dès maintenant.
6082;post;Marketing promotionnel : boostez vos ventes efficacement;Exploitez le marketing promotionnel pour dynamiser vos ventes et attirer de nouveaux clients. Apprenez toutes les astuces pour réussir vos promotions !
5956;post;Packaging : outil de vente et levier de communication;Découvrez comment le packaging devient un outil de vente et un support de communication stratégique pour dynamiser votre marketing.
5865;post;Livre blanc : conseils rédaction et génération de leads;Apprenez à créer un livre blanc impactant pour asseoir votre notoriété et attirer des leads grâce à des conseils de rédaction éprouvés.
5853;post;Exemple communiqué de presse : astuces rédaction 2.0;Apprenez à rédiger un communiqué de presse réussi. Nos exemples et conseils 2.0 boostent vos relations presse dès aujourd'hui.
5841;post;Gleeden, stratégie marketing : succès et controverse;Apprenez la stratégie marketing/web de Gleeden, audacieuse et innovante, mais confrontée à des défis de réputation. Lisez notre analyse approfondie.
5817;post;Sun Tzu & l’Art de la Guerre : 10 leçons marketing;Téléchargez le PDF et apprenez 10 leçons marketing inspirées de l’Art de la Guerre de Sun Tzu pour transformer votre stratégie dès aujourd'hui.
5634;post;Marketing direct : stratégies éprouvées pour campagnes efficaces;Maîtrisez le marketing direct avec nos conseils d'experts : fixez objectifs, ciblez précisément et analysez pour des campagnes rentables. Lisez notre guide.
5566;post;M-Commerce : pratiques, exemples et conseils;Apprenez à tirer profit du m-commerce avec notre guide complet. Astuces pratiques, exemple réel et conseils pour booster votre stratégie mobile.
5544;post;WOM (Word of Mouth) : stratégies pour booster le bouche à oreille;Découvrez des techniques éprouvées pour dynamiser le bouche à oreille et générer un buzz viral. Apprenez à exploiter le WOM pour renforcer votre notoriété.
5520;post;Vidéo virale : 10 conseils clés et 6 cas concrets;Apprenez à exploiter le pouvoir de la vidéo pour dynamiser votre marque avec 10 conseils efficaces et 6 exemples concrets. Lisez notre guide complet !
5507;post;Exemple marketing sensoriel : 13 cas réussis et ratés;Explorez 13 exemples de marketing sensoriel, entre succès et échecs, pour saisir les clés d'une communication sensorielle efficace.
5052;post;L'agence RP 2.0 : évolution en infographie;RP 2.0 en infographie : suivez l'évolution des relations presse, de la tradition aux stratégies numériques innovantes. Accédez vite à l'infographie.
5120;post;Exact Target : décryptage du rachat par Salesforce;Comprenez le rachat d'Exact Target par Salesforce.com et l'enjeu des plateformes de marketing automation pour vos stratégies digitales.
4016;post;CAC40 : classement et analyse des comptes Twitter;Apprenez l'analyse détaillée des comptes Twitter des entreprises du CAC40 : abonnés, contenus et stratégies RP/RH en pleine évolution. Lisez notre étude complète !
4001;post;Logo : l'évolution des marques à travers le temps;Explorez l’évolution des logos emblématiques et découvrez comment les grandes marques transforment leur image au fil des décennies.
3983;post;Rich Snippets : 9 types d'extraits enrichis à connaître;Explorez 9 types d'extraits enrichis (rich snippets) améliorant l'affichage de vos résultats de recherche. Boostez votre visibilité en ligne dès aujourd'hui !
3929;post;Codes internet : guide essentiel pour votre site;Apprenez à maîtriser les codes internet (FTP, BDD, admin) pour optimiser la gestion et la sécurité de votre site. Lisez notre guide complet maintenant !
3531;post;La vache pourpre : comment Seth Godin révolutionne le marketing;Explorez la Vache Pourpre de Seth Godin, concept innovant redéfinissant le marketing moderne. Apprenez ses secrets pour dynamiser votre stratégie !
3126;post;Entonnoir de conversion : repensez votre stratégie;Découvrez 6 métaphores alternatives qui révèlent la complexité du parcours client, bien au-delà d'une approche simpliste.
2826;post;App marketing : optimisez votre app iOS & Android;Réinventez votre stratégie d'app marketing grâce au web. Apprenez à booster la visibilité de votre application iOS et Android dès maintenant.
2626;post;Nuancier Ricard appli mobile : rôle et atouts;Apprenez comment la nouvelle appli mobile de Pernod Ricard transforme l'expérience digitale avec son nuancier d'options innovantes. Lisez notre analyse !
2487;post;Top 1000 YouTubers français : infographie & insights;Découvrez l'infographie des top 1000 YouTubers français avec analyse des tendances, influence et contenus marquants sur Youtube. Explorez les stats clés dès maintenant!
2472;post;Think with Google : brand content innovant;Explorez Think with Google, référence en brand content. Accédez à des études marketing et insights pour dynamiser votre stratégie online.
2143;post;Dessine moi l'éco : la réussite Sydo en vidéo;Apprenez comment Sydo révolutionne la pédagogie grâce à ses vidéos 'Dessine moi l'éco'. Découvrez les clés d'une réussite éprouvée.
2078;post;Lead nurturing : boostez votre inbound marketing;Maîtrisez le lead nurturing pour dynamiser votre inbound marketing et transformer vos prospects en clients. Lisez nos conseils pratiques sur 1min30.
2043;post;Michel et Augustin logo : design décalé et original;Découvrez comment le Michel et Augustin logo incarne un packaging original mêlant caricature et cartoon pour une identité décalée. Lisez notre analyse complète !
1959;post;Call-to-action en content marketing : boostez l’engagement;Explorez comment les call-to-action guident vos visiteurs et renforcent l’engagement. Apprenez à optimiser vos CTA pour convertir efficacement.
1630;post;Stratégie contenu : Faustine Amoré chez 1min30;Faustine Amoré, experte en stratégie digitale de 1min30, vous explique comment créer une stratégie de contenu efficace pour booster votre visibilité.
1517;post;Frédéric Bascunana : pub de luxe, contenu indispensable;Frédéric Bascunana explique en vidéo pourquoi la pub luxueuse laisse place à un contenu authentique. Apprenez à gagner la confiance de vos clients !
1010;post;Inbound & Outbound Marketing : stratégies complémentaires;Maîtrisez l'art d'allier inbound et outbound marketing pour booster votre visibilité en ligne. Apprenez nos techniques complémentaires et obtenez des résultats concrets.
3029;post;Evian : pub viral pour un bain de jouvence;Apprenez comment la campagne publicitaire virale d'Evian redéfinit l'image de marque et offre un bain de jouvence. Lisez notre analyse complète.
2918;post;Marketing BtoB vs BtoC : stratégies gagnantes;Comprenez la différence entre le marketing BtoB et BtoC et adoptez des stratégies performantes pour booster votre visibilité en ligne.
2162;post;Sortir d’un océan rouge : plonger dans un océan bleu;L'industrie pharmaceutique réinvente sa stratégie en passant d'un océan rouge traditionnel à un océan bleu innovant. Lisez l'analyse complète.
110603;post;AFPA Talent : campagne multicanal pour jeunes ambitieux;Apprenez comment AFPA Talent révolutionne sa stratégie multicanal pour offrir de nouvelles opportunités aux jeunes. Lisez l'article complet !
2148;post;Stratégie social media : 8 étapes clés pour réussir;Découvrez 8 étapes essentielles pour élaborer une stratégie social media percutante et booster votre engagement. Lisez notre guide complet dès maintenant !
2136;post;The Social Network : le film qui révèle Facebook;Apprenez l'histoire du film 'The Social Network' de David Fincher retraçant la création de Facebook par Mark Zuckerberg. Lisez notre analyse détaillée.
2016;post;Restaurant Océan Bleu : stratégie du chef aveyronnais;Découvrez comment la stratégie Océan Bleu transforme les restaurants grâce à l’approche innovante d’un chef aveyronnais étoilé. Lisez l’article pour innover !
1668;post;Canevas stratégique : adoptez l’océan bleu en entreprise;Utilisez un canevas stratégique pour déployer une stratégie océan bleu innovante dans votre entreprise. Lisez notre guide complet dès maintenant.
1609;post;Canevas stratégique : l’Océan Bleu pour innover;Apprenez comment le canevas stratégique de l’Océan Bleu révolutionne l’innovation en entreprise grâce à des méthodes éprouvées. Lisez notre guide complet.
757;post;ARCA CONSEIL : communication web pour PME;Lisez l'interview exclusive de Samy Benarroch, PDG d'ARCA CONSEIL, sur comment optimiser la communication web et la recherche d'infos économiques, juridiques et financières.
859;post;Stratégies de différenciation : Bang & Olufsen et Kinder;Apprenez comment des stratégies de différenciation efficaces permettent de se démarquer, à l'image de Bang & Olufsen et Kinder. Lisez notre analyse !
