id;type;seo_title;seo_description
1287551734;post;Formation HubSpot : choisissez la formation idéale;Optimisez votre CRM et vos process marketing avec la formation HubSpot idéale. Identifiez vos besoins et boostez votre équipe grâce à nos conseils experts.
1287551585;post;Data Storytelling : transformez vos données en récits;Apprenez comment transformer vos données brutes en récits percutants pour engager efficacement votre audience. Lisez notre guide complet dès maintenant.
1287551323;post;Mistral AI : alternative française à ChatGPT;Découvrez Mistral AI, l'alternative française à ChatGPT offrant une confidentialité optimale grâce au traitement local de vos données. Testez-la dès aujourd'hui !
1287551405;post;Télécharger HubSpot : fidélisation client – Podcast 1min30;Téléchargez notre podcast exclusif et découvrez comment HubSpot révolutionne la fidélisation client. Profitez de conseils pratiques – écoutez dès maintenant !
1287551073;post;ChatGPT.40 : révélations sur les nouveautés de ChatGPT-4o;Apprenez comment ChatGPT-4o révolutionne vos interactions numériques grâce à une compréhension contextuelle affinée et une gestion multimodale. Lisez notre analyse complète.
1287550604;post;RCU : améliorez votre expérience client et optimisez votre CRM;Apprenez comment le Référentiel Client Unique (RCU) élimine les doublons et centralise vos données pour optimiser l'expérience client et la gestion CRM. Lisez notre guide complet !
1287549892;post;Formation HubSpot : boostez l'adoption par votre équipe;Boostez l'adoption d'HubSpot dans votre entreprise avec notre formation premium. Personnalisez vos sessions et surmontez les défis dès aujourd'hui.
1287549671;post;Dette technique : causes, impacts et solutions efficaces;Maîtrisez la dette technique en identifiant ses signes et impacts sur vos projets logiciels. Apprenez des solutions éprouvées pour optimiser vos développements.
1287549551;post;HubSpot API : guide d’intégration, avantages et limites;Explorez comment les HubSpot API transforment votre CRM grâce à une intégration, personnalisation et automatisation efficaces. Lisez notre guide complet aujourd'hui !
1287548401;post;Incoterms 2023 : guide pour le commerce international;Comprenez les Incoterms 2023 et leurs enjeux pour le commerce international. Profitez de conseils pratiques pour optimiser vos échanges dès maintenant.
1287547932;post;Méthode CRAC : préparer objections dans Sales Deck;Découvrez la méthode CRAC pour préparer vos réponses aux objections et les paramétrer dans Sales Deck. Boostez vos ventes dès maintenant !
1287547970;post;Flux de données en continu : boostez votre performance;Apprenez comment la diffusion continue des flux de données optimise l'efficacité de votre entreprise et renforce sa compétitivité. Lisez notre guide complet !
1287547423;post;Schéma directeur : élaborez votre plan informatique;Apprenez à créer un schéma directeur efficace pour structurer votre plan informatique et atteindre vos objectifs. Lisez notre guide complet.
1287547267;post;HubSpot persona : guide complet de création;Apprenez à créer des personas impactants avec HubSpot. Suivez ce guide pas à pas pour booster votre stratégie marketing dès aujourd'hui.
1287547041;post;IA marketing : boostez votre stratégie digitale;Apprenez comment l'IA transforme le marketing digital en améliorant personnalisation, ciblage et expérience client. Lisez notre guide complet.
1287547012;post;Chief revenue officer : outils pour booster vos OKRs;Découvrez comment un chief revenue officer utilise des outils performants pour planifier, mesurer et atteindre ses OKRs. Optimisez dès maintenant votre stratégie de vente !
1287546317;post;Sales Enablement : Stratégies et outils essentiels;Maîtrisez le sales enablement grâce à ce guide complet : stratégies, outils et étapes pour booster vos ventes. Lisez nos conseils pour réussir.
1287546139;post;Modèles de leadership : top 3 exemples pour booster votre activité;Apprenez à choisir et appliquer des modèles de leadership efficaces. 3 exemples concrets pour dynamiser votre management et booster votre entreprise.
1287545980;post;Plan de découverte : guide pour une prospection efficace;Optimisez votre prospection téléphonique avec un plan de découverte bien structuré. Nos conseils vous aident à recueillir les informations clés.
1287545867;post;Branding : définition, enjeux et stratégies efficaces;Explorez comment une stratégie de branding solide renforce l'identité de votre marque. Lisez notre guide pour comprendre ses enjeux et bénéfices.
1287545827;post;Chief revenue : interview avec Fabien Arneodo;Explorez le métier du Chief Revenue Officer avec Fabien Arneodo de eShots Labs. Apprenez comment ce rôle innovant révolutionne la stratégie d’entreprise.
1287545624;post;Sales operations et enablement : comprendre les différences;Apprenez les différences essentielles entre sales operations et sales enablement. Lisez notre guide pour maîtriser ces deux approches et booster votre performance !
1287545559;post;Chief Revenue Officer : rôle et missions clés;Apprenez comment le Chief Revenue Officer (CRO) optimise et développe les revenus en synergie avec le marketing, la vente et le service. Lisez notre guide complet.
1287545505;post;Enablement : 5 clés pour dynamiser vos partenariats;Explorez comment le Partner Enablement transforme votre stratégie de partenariat et booste vos ventes grâce à des actions ciblées. Lisez notre guide !
1287545375;post;Université d'entreprise : définition, enjeux et succès;Apprenez comment instaurer une université d'entreprise pour dynamiser la formation et booster l'agilité de vos équipes. Lisez nos conseils pratiques !
1287544588;post;Positionnement d’entreprise : exprimez-le efficacement;Valorisez votre positionnement avec des stratégies claires et des supports de communication efficaces. Apprenez à renforcer votre identité de marque dès aujourd’hui !
1287544541;post;Matrice ERAC : alignez communication RH et marque employeur;Boostez l'attractivité de votre entreprise grâce à la matrice ERAC pour harmoniser communication RH et marque employeur. Lisez nos conseils pratiques.
1287544568;post;Valeurs d'entreprise : 3 astuces pour réussir;Construisez une identité forte et authentique. Apprenez à définir les valeurs d'une entreprise avec 3 astuces éprouvées pour renforcer votre marque.
1287544208;post;Réunion commerciale : 20 min pour booster vos ventes;Boostez votre équipe de vente en 20 min grâce à une réunion commerciale efficace. Structurez vos échanges et atteignez vos objectifs. Lisez nos conseils.
1287544214;post;Mood board définition : créez votre univers visuel;Apprenez à réaliser un mood board efficace pour affirmer l'identité visuelle de votre marque. Guide étape par étape pour réussir.
1287544201;post;Modèle de plan de communication : schématisez votre stratégie;Apprenez à construire un plan de communication percutant avec notre modèle précis. Suivez chaque étape essentielle pour réussir votre stratégie.
1287544219;post;Promesse de marque : 6 étapes clés pour la définir;Apprenez à utiliser l’Onlyness Statement Canvas pour élaborer une promesse de marque authentique en 6 étapes essentielles. Lisez notre guide complet.
1287544141;post;Politique de marque : 6 stratégies pour booster votre offre;Découvrez 6 stratégies essentielles pour définir et renforcer votre politique de marque afin d’optimiser votre gamme de produits.
1287544136;post;Produit de gamme : 6 stratégies pour booster votre offre;Apprenez à optimiser votre produit de gamme avec 6 stratégies éprouvées. Renforcez votre compétitivité et affirmez votre offre dès aujourd'hui.
1287544068;post;Brand book : guide essentiel pour créer votre identité;Apprenez comment un brand book renforce l'identité de marque et assure une communication uniforme. Lisez notre guide complet dès maintenant.
1287543995;post;Fichier de prospection : 6 stratégies pour booster vos ventes;Maîtrisez votre fichier de prospection grâce à 3 leviers gratuits et 3 payants pour booster vos ventes. Apprenez des techniques éprouvées maintenant !
1287543983;post;Chef de marque vs chef de produit : guide complet;Explorez les différences clés entre chef de marque et chef de produit. Apprenez missions, compétences et enjeux pour orienter votre stratégie.
1287543750;post;7P du marketing des services : guide stratégique;Maîtrisez les 7P du marketing des services pour optimiser votre offre et satisfaire vos clients. Apprenez nos astuces pratiques dès maintenant.
1287543705;post;Copy strategy : formalisez votre plan de communication;Apprenez à structurer votre plan de communication grâce à la copy strategy en 5 étapes clés. Lisez notre guide complet pour booster votre stratégie.
1287543698;post;Double diamant : optimisez votre stratégie marketing;Inspirée du design thinking, la méthode du double diamant en 4 étapes clés optimise votre plan marketing. Apprenez à transformer votre stratégie.
1287543671;post;Consultant bilan de compétences : réussir votre évaluation;Boostez votre carrière grâce à un bilan de compétences stratégique. Apprenez à exploiter votre potentiel avec l’aide d’un consultant spécialisé. Lisez notre guide complet.
1287543216;post;Rédigez des propositions de valeur efficaces : conseils experts;Apprenez à formuler des propositions de valeur percutantes avec la méthode Value Design et boostez l’attractivité de votre marque.
1287543468;post;Stratégie opérationnelle marketing : guide pratique;Apprenez à élaborer une stratégie opérationnelle marketing gagnante grâce à des étapes concrètes et des conseils pratiques pour booster votre entreprise.
1287543308;post;Typologie client : 10 profils et stratégies d'adaptation;Identifiez les 10 profils clients et optimisez votre approche commerciale grâce à notre guide sur la typologie client. Adaptez votre stratégie dès aujourd'hui !
1287543339;post;L'Illustrator : guide des bases pour débutants | 1min30;Maîtrisez Adobe Illustrator, l'outil indispensable pour créer logos, icônes et illustrations. Apprenez ses bases et boostez votre créativité dès aujourd'hui.
1287542534;post;Les étapes de la vente : 7 clés pour réussir | 1min30;Maîtrisez les 7 étapes de la vente et boostez vos résultats. Apprenez des stratégies indispensables pour conclure efficacement chaque transaction.
1287542392;post;Processus d'achat : maîtrisez ses étapes clés;Apprenez le processus d'achat et explorez ses phases essentielles pour améliorer votre stratégie marketing. Lisez notre guide complet pour booster vos ventes.
1287542191;post;Positionnement d'une marque : bâtissez votre succès;Boostez l'image de votre marque grâce à un positionnement efficace. Apprenez à vous démarquer sur un marché concurrentiel.
1287542195;post;Prisme d'identité : définissez l'ADN de votre marque;Apprenez comment le prisme d'identité structure votre histoire, vos valeurs et votre positionnement pour construire une marque forte.
1287542302;post;Plan d’action marketing : 5 étapes pour réussir;Apprenez à élaborer un plan d’action marketing efficace. Suivez nos 5 étapes clés pour structurer vos actions et booster votre entreprise dès aujourd'hui.
1287542138;post;Marketing responsable : enjeux & succès inspirants;Apprenez comment le marketing responsable ancré dans la RSE transforme le monde des affaires. Lisez notre guide pour trois exemples inspirants.
1287541850;post;Intelligence collective : enjeux et solutions pour innover;Apprenez comment l’intelligence collective booste l’innovation et la performance en entreprise à l’ère numérique. Lisez notre guide complet.
1287541864;post;Créer un masque PowerPoint : 4 étapes essentielles;Maîtrisez la création de votre masque PowerPoint avec notre guide en 4 étapes pour des présentations professionnelles et personnalisées. Apprenez dès aujourd'hui !
1287541855;post;ADN de marque : stimulez votre plateforme de marque;Apprenez à définir et valoriser votre ADN de marque avec une plateforme efficace. Conseils pratiques pour un positionnement unique.
1287541818;post;Mailchimp : créez votre newsletter en 4 étapes;Apprenez à utiliser Mailchimp pour concevoir des newsletters attractives. Suivez nos 4 étapes et dynamisez vos campagnes e-mailing dès aujourd'hui.
1287541443;post;Bot Linkedin : fonctionnement et avantages clés;Apprenez le fonctionnement du bot Linkedin et boostez votre prospection. Explorez ses fonctionnalités et avantages pour optimiser votre réseau.
1287541032;post;Webflow : définition et fonctionnement intuitif;Découvrez comment Webflow révolutionne la création de sites web grâce à son interface intuitive et ses fonctionnalités complètes. Apprenez-en plus dès maintenant !
1287541237;post;Facilitateur : rôle et outils pour exceller;Apprenez le rôle essentiel du facilitateur en entreprise et maîtrisez les outils clés pour renforcer la communication inter-équipes. Lisez notre guide complet.
1287541290;post;PBN : définition et conseils pour l’éviter;Le PBN, autrefois prisé, est désormais sanctionné par Google. Apprenez ce qu’est un PBN et comment minimiser ses risques pour votre SEO.
1287541285;post;Devenir consultant indépendant : 4 étapes clés pour réussir;Boostez votre carrière en consultant indépendant. Suivez nos 4 étapes indispensables pour maîtriser les démarches administratives et réussir dès maintenant.
1287541302;post;Google Sites : guide simple pour créer votre site;Exploitez Google Sites pour concevoir des sites web collaboratifs et performants. Apprenez astuces et étapes clés pour réussir votre projet en ligne.
1287541404;post;Charte valeurs : guide pratique et efficace;Apprenez à créer une charte de valeurs forte pour renforcer votre culture d’entreprise et booster la cohésion d’équipe. Lisez notre guide complet !
1287540804;post;Figma : à quoi sert-il ? Guide UX/UI gratuit;Apprenez comment Figma révolutionne le design collaboratif en ligne. Réalisez des prototypes UX/UI innovants pour booster vos projets web dès aujourd'hui.
1287540576;post;CANVA : guide pratique et atouts clés;Explorez CANVA pour créer des designs professionnels et personnels en toute simplicité. Apprenez les fonctionnalités et boostez votre créativité.
1287539886;post;Comment faire une biographie sur Wikipédia: guide indispensable;Apprenez à rédiger une biographie sur Wikipédia étape par étape, en respectant les consignes de notabilité et en valorisant votre image. Lisez notre guide complet !
1287540212;post;Écoute active : définition et 5 conseils essentiels;Maîtrisez l'écoute active pour améliorer vos interactions. Comprenez ses bénéfices et adoptez 5 conseils pratiques pour optimiser vos échanges au quotidien.
1287539846;post;Créer une page Wikipédia : guide pratique et étapes clés;Apprenez à créer une page Wikipédia conforme en suivant chaque étape, de la création du profil à la gestion du contenu. Lisez notre guide complet !
1287539951;post;Agence marketing : missions et services clés;Apprenez comment une agence marketing dynamise votre entreprise grâce à un ensemble de services sur mesure. Lisez notre guide complet.
1287539802;post;Intelligence collective : maîtrisez divergence et convergence;Maîtrisez le processus de divergence et convergence, piliers de l’intelligence collective. Apprenez à stimuler créativité et innovation dès aujourd’hui.
1287540116;post;Valentin campagne : top 10 campagnes de Saint-Valentin 2022;Apprenez comment ces 10 campagnes de Saint-Valentin 2022 ont marqué les esprits et inspirez vos stratégies marketing avec notre analyse complète !
1287539756;post;Web 2.0 et ses évolutions : différences entre web 1.0, 2.0 et 3.0;Comparez les évolutions du web 1.0, 2.0 et 3.0 pour comprendre l'impact de chaque phase sur la transformation digitale.
1287539664;post;Internet 3.0 : origine, évolution et impact;Maîtrisez les principes de l'Internet 3.0 : découvrez son origine, son évolution et son impact révolutionnaire sur le web.
1287539659;post;Web 1.0 : histoire et caractéristiques clés;Apprenez l'histoire du web 1.0 et ses caractéristiques qui ont façonné le numérique. Lisez notre analyse complète dès maintenant !
1287539562;post;Brand Strategy Design : méthode stratégique | 1min30;Explorez le Brand Strategy Design en 1min30 : apprenez à renforcer votre marque grâce à notre webinaire dédié au nouvel ouvrage collaboratif.
1287539427;post;Les 4 P marketing : boostez produit, prix & distribution;Apprenez comment la stratégie des 4 P transforme votre offre : optimisez produit, prix, distribution et promotion pour un marketing efficace. Lisez nos conseils pratiques !
1287513519;post;Définition d'un budget : conseils et méthode efficace;Maîtrisez la prévision budgétaire : apprenez à définir un budget d'entreprise avec une méthode éprouvée et des conseils pratiques. Lisez notre guide complet.
1287539324;post;Funnel marketing : étapes clés du tunnel;Découvrez comment le funnel marketing transforme un visiteur en client avec des étapes essentielles. Lisez notre guide pour optimiser votre conversion.
1287538942;post;iPaas : intégration de données, limites et alternatives;Comprenez comment les iPaas transforment l'intégration de données. Analysez leurs limites et explorez des alternatives performantes pour booster vos projets.
1287513516;post;POC définition : testez et validez votre innovation;Découvrez comment le proof of concept (POC) optimise votre offre en testant et validant vos idées. Apprenez ses avantages et sa méthodologie maintenant !
1287521273;post;Engagement client : comprendre et mesurer son impact;Découvrez comment mesurer l'engagement client pour optimiser la communication entre marque et consommateur. Apprenez des techniques éprouvées pour booster votre relation client.
1287524741;post;Facteurs clés de succès : exemples en services et conseils;Découvrez des exemples concrets illustrant les facteurs clés de succès dans les sociétés de services et conseils. Lisez notre analyse pour booster votre stratégie.
1287513522;post;Propale commerciale : créez une proposition qui convertit;Apprenez à construire une propale percutante. Suivez les étapes clés pour convaincre et transformer vos prospects en clients.
1287537929;post;Réseaux sociaux et communication : plan et spécificités;Explorez notre guide stratégique pour élaborer un plan de communication sur les réseaux sociaux et booster votre visibilité en ligne. Lisez nos conseils pratiques.
1287535406;post;Hiérarchie en entreprise : choisir la structure idéale;Optimisez la hiérarchie en entreprise en adoptant une structure d'organisation adaptée à vos équipes. Apprenez à définir le modèle optimal.
1287535420;post;Organisation entreprise : la clé de la performance;Boostez la rentabilité de votre entreprise grâce à une organisation structurée. Apprenez comment optimiser la cohérence de vos activités pour réussir.
1287532990;post;CallBot vs ChatBot : adoptez l'agent conversationnel;Choisissez l'agent conversationnel idéal grâce à notre comparatif détaillé entre CallBot et ChatBot. Lisez notre analyse pour orienter votre décision.
1287535158;post;EVP : boostez votre marque employeur;Attirez et fidélisez les talents grâce à une stratégie EVP efficace. Apprenez à créer une proposition de valeur employé pour renforcer votre marque.
1287532658;post;Plan d'action marketing : élaborez votre stratégie efficace;Découvrez comment élaborer un plan d'action marketing structuré et efficace. Suivez notre guide pas à pas pour dynamiser votre stratégie.
1287532710;post;Parcours d'achat : définition, étapes et exemples | 1min30;Comprenez le parcours d'achat et ses étapes clés pour transformer vos prospects en clients. Apprenez à optimiser chaque phase de votre acquisition.
1287513228;post;Diagnostic commercial interne : guide essentiel;Maîtrisez votre diagnostic commercial interne pour optimiser vos stratégies. Lisez notre guide complet et conseils experts pour réussir.
1287509568;post;Parcours d'achat & client : comprendre les différences;Analysez les distinctions entre le parcours d'achat et le parcours client. Apprenez à adapter vos stratégies pour convertir plus efficacement.
1287523882;post;Outils digitaux : clés pour réussir votre transformation;Apprenez à maîtriser les outils digitaux indispensables pour transformer votre entreprise et booster votre croissance.
1287508851;post;Parcours client : définition, méthodes et conseils pratiques;Découvrez tout sur le parcours client : définition, modélisation et astuces pour optimiser l'expérience utilisateur.
1287521700;post;Acquisition digitale : 4 leviers pour booster vos clients;Découvrez 4 leviers stratégiques pour réussir votre acquisition digitale et transformer vos prospects en clients fidèles.
1287523639;post;Solution emailing : 6 logiciels indispensables;Découvrez 6 solutions d'emailing performantes pour optimiser vos campagnes marketing. Apprenez à choisir l'outil adapté à votre stratégie.
1287517339;post;Stratégie de communication digitale : 3 méthodes incontournables;Explorez 3 méthodes éprouvées pour optimiser votre stratégie de communication digitale et capter l'attention sur le numérique. Lisez notre guide complet.
1287519605;post;Culture d'entreprise différenciante : boostez votre attractivité;Découvrez comment une culture d'entreprise différenciante renforce la marque employeur et attire les talents. Lisez notre analyse approfondie.
1287517317;post;Analyse marketing : 7 méthodes pour booster vos données;Boostez vos performances en maîtrisant 7 méthodes d'analyse marketing alliant mesures quantitatives et insights qualitatifs. Lisez notre guide complet !
1287512360;post;Cycle de vente : étapes essentielles pour réussir;Maîtrisez le cycle de vente, de la prospection à la fidélisation, grâce à nos conseils pour optimiser votre stratégie commerciale. Lisez notre guide complet maintenant !
1287513169;post;Diagnostic commercial : guide pratique pour booster vos ventes;Apprenez comment réaliser un diagnostic commercial complet pour analyser vos forces et faiblesses. Outils et conseils pour optimiser votre stratégie de vente.
1287515122;post;Démarche marketing : guide des étapes clés;Découvrez les étapes essentielles de la démarche marketing pour optimiser votre stratégie et booster vos résultats. Apprenez à définir votre approche dès aujourd'hui !
1287513709;post;Edition de logiciel : réussir votre SaaS en France;Apprenez à lancer votre logiciel SaaS en France avec nos conseils experts. Guide pratique pour startups en édition de logiciel.
1287514346;post;Vente à domicile : astuces pratiques pour réussir;Apprenez comment booster votre activité de vente à domicile avec des conseils pratiques et un cadre légal adapté. Lisez notre guide complet !
1287515111;post;Stratégie marketing : 5 étapes pour booster votre succès;Apprenez 5 étapes essentielles pour élaborer une stratégie marketing efficace. Profitez de conseils pratiques pour maximiser votre performance.
1287513766;post;Analyse marketing : définition, outils et conseils;Apprenez ce qu'est l'analyse marketing et maîtrisez ses outils indispensables pour booster votre stratégie en 5 étapes efficaces.
1287513731;post;Expérience client : boostez la fidélisation dès aujourd'hui;Apprenez comment offrir une expérience client irréprochable pour fidéliser vos clients. Astuces et conseils pratiques à mettre en place dès maintenant.
1287513185;post;Fiche prospect : guide pratique pour la réaliser;Apprenez étape par étape à construire une fiche prospect pour booster votre prospection commerciale. Suivez notre guide complet dès aujourd'hui.
1287513429;post;Positionnement marketing : conseils pour se démarquer;Apprenez à élaborer un positionnement marketing efficace avec des stratégies éprouvées et maximisez l'impact de votre marque dès aujourd'hui.
1287513188;post;Fichier de prospection : guide complet pour booster vos ventes;Apprenez à construire un fichier de prospection efficace pour maximiser vos ventes grâce à des conseils pratiques et des astuces innovantes.
1287512952;post;Cibles marketing : définition et méthodes clés;Apprenez à identifier vos cibles marketing pour booster votre stratégie. Méthodologie, définitions et conseils concrets pour réussir.
1287512931;post;Satisfaction client : enjeux et stratégie gagnante;Apprenez comment la satisfaction client, née dans les années 70, révolutionne la fidélisation. Obtenez les clés pour optimiser l'expérience client.
1287512942;post;Comment financer une formation : astuces CPF et entreprise;Découvrez comment financer votre formation en combinant le CPF et l'appui de votre entreprise. Apprenez des astuces pratiques pour booster votre projet.
1287512365;post;Plan de découverte : boostez vos entretiens;Découvrez comment instaurer un plan de découverte efficace lors de l'entretien avec un prospect et poser les bonnes questions pour booster vos ventes.
1287511288;post;Données structurées : tout ce qu'il faut savoir;Exploitez les données structurées pour optimiser votre SEO et booster votre visibilité. Lisez notre guide complet !
1287510761;post;Content writing vs Copywriting : différences essentielles;Apprenez les différences entre content writing et copywriting pour booster votre stratégie digitale. Lisez notre guide complet !
1287510786;post;Public Relations Télévision : boostez votre stratégie marketing;Apprenez comment la publicité TV renforce vos relations publiques et dynamise votre image. Lisez notre guide complet pour maîtriser ce levier médiatique.
